{
    "$schema": "http://json-schema.org/draft-07/schema#",
    "$id": "urn:plasmazones:schema:surface-metadata",
    "title": "PlasmaZones Surface Shader Metadata",
    "description": "metadata.json for a bundled or user surface (decoration) shader pack. Core identity and the parameter contract are enforced. Optional compositing and multipass keys (providesBorder, providesOpacityTint, needsBackdrop, interiorOpaque, multipass, bufferShaders, bufferScale, bufferScales, bufferFeedback, bufferWrap, bufferWraps, bufferFilter, bufferFilters, depthBuffer, halfFloatBuffers, animated, audio, paddingParam, vertexShader, textures, and the retired handlesOpacity), named parameter presets and descriptive metadata (description, author, version, category, preview) are allowed through.",
    "type": "object",
    "required": ["id", "name", "fragmentShader", "parameters"],
    "additionalProperties": false,
    "properties": {
        "id": { "type": "string", "minLength": 1 },
        "name": { "type": "string", "minLength": 1 },
        "description": { "type": "string" },
        "author": { "type": "string" },
        "version": { "type": "string" },
        "category": { "type": "string" },
        "preview": { "type": "string" },
        "fragmentShader": { "type": "string", "minLength": 1 },
        "vertexShader": { "type": "string" },
        "animated": { "type": "boolean" },
        "audio": { "type": "boolean" },
        "handlesOpacity": {
            "type": "boolean",
            "description": "Retired and ignored. Opacity is layer-backed now (the compositor folds the window's resolved opacity into the chain), so packs no longer declare it. Accepted only so pre-existing pack metadata still validates."
        },
        "providesBorder": { "type": "boolean" },
        "providesOpacityTint": { "type": "boolean" },
        "needsBackdrop": { "type": "boolean" },
        "interiorOpaque": { "type": "boolean" },
        "multipass": { "type": "boolean" },
        "bufferShaders": {
            "type": "array",
            "items": { "type": "string" },
            "maxItems": 8
        },
        "bufferScale": { "type": "number", "minimum": 0.0078125, "maximum": 1.0 },
        "bufferScales": {
            "type": "array",
            "items": { "type": "number", "minimum": 0.0078125, "maximum": 1.0 },
            "maxItems": 8
        },
        "bufferFeedback": { "type": "boolean" },
        "bufferWrap": { "type": "string", "enum": ["clamp", "repeat", "mirror"] },
        "bufferWraps": {
            "type": "array",
            "items": { "type": "string", "enum": ["clamp", "repeat", "mirror"] },
            "maxItems": 8
        },
        "bufferFilter": { "type": "string", "enum": ["linear", "nearest", "mipmap"] },
        "bufferFilters": {
            "type": "array",
            "items": { "type": "string", "enum": ["linear", "nearest", "mipmap"] },
            "maxItems": 8
        },
        "depthBuffer": { "type": "boolean" },
        "halfFloatBuffers": { "type": "boolean" },
        "paddingParam": { "type": "string" },
        "textures": {
            "type": "array",
            "maxItems": 3,
            "items": {
                "type": "object",
                "required": ["path"],
                "properties": {
                    "path": { "type": "string", "minLength": 1 },
                    "wrap": { "type": "string", "enum": ["clamp", "repeat", "mirror"] }
                }
            }
        },
        "presets": {
            "type": "object",
            "maxProperties": 64,
            "description": "Named parameter presets. Each value is a map of parameter id to value, naming a subset of the pack's declared parameters. A preset id is its key here, and it is also the label the picker shows, so it has to read as a name. That rules out control and bidi-formatting characters, and anything longer than a label can show. Unlike a user preset id it never becomes a filename, because duplicating a pack preset mints a fresh UUID. A null value is allowed and means the preset says nothing about that parameter, so it keeps the pack's default; the loader drops the entry. Those rules are checked by plasmazones-shader-validate rather than here, because the vendored JSON-schema validator rejects every name under a propertyNames rule, legitimate ones included.",
            "additionalProperties": {
                "type": "object",
                "maxProperties": 48,
                "additionalProperties": { "type": ["number", "string", "boolean", "null"] }
            }
        },
        "parameters": {
            "type": "array",
            "maxItems": 48,
            "items": { "$ref": "#/definitions/parameter" }
        }
    },
    "definitions": {
        "parameter": {
            "type": "object",
            "required": ["id", "name", "type", "default"],
            "properties": {
                "id": { "type": "string", "minLength": 1 },
                "name": { "type": "string", "minLength": 1 },
                "description": { "type": "string" },
                "group": { "type": "string" },
                "type": {
                    "type": "string",
                    "enum": ["float", "int", "bool", "color"],
                    "description": "Marshalling type of the uniform. Images are declared under `textures`, not as parameters. An unknown type cannot be bound, so it is rejected."
                },
                "default": {
                    "type": ["number", "string", "boolean"],
                    "description": "Default value. Use a string for color (#aarrggbb), a number for float or int, and a boolean for bool."
                },
                "min": { "type": "number" },
                "max": { "type": "number" },
                "step": { "type": "number" }
            },
            "additionalProperties": false
        }
    }
}
