{
    "id": "border-rgb",
    "name": "RGB Cycle",
    "description": "Rounded corners and a window border painted as a full colour wheel wrapped around the frame, slowly rotating. The classic gaming-rig ring. Set the speed to zero for a still rainbow.",
    "author": "PlasmaZones",
    "version": "1.1",
    "category": "Borders",
    "providesBorder": true,
    "animated": true,
    "fragmentShader": "effect.frag",
    "parameters": [
        {
            "id": "borderWidth",
            "name": "Border width",
            "type": "int",
            "default": 3,
            "min": 1,
            "max": 20,
            "description": "Thickness of the colour ring (px)"
        },
        {
            "id": "cornerRadius",
            "name": "Corner radius",
            "type": "int",
            "default": 8,
            "min": 0,
            "max": 64,
            "description": "Roundness of the corners (px, 0 for square)"
        },
        {
            "id": "roundBottomCorners",
            "name": "Round bottom corners",
            "type": "bool",
            "default": true,
            "description": "Round the bottom corners as well as the top. Turn off to round only the top two, for a pane that sits against a panel or the screen edge. Every pack in the chain that offers this setting follows one answer, so their bottom corners are all rounded or all square. Set it on any pack and the whole chain follows. Where two packs have it set differently, the one earliest in the chain wins."
        },
        {
            "id": "edgeSoftness",
            "name": "Edge softness",
            "type": "float",
            "default": 0.7,
            "min": 0.1,
            "max": 2.0,
            "description": "Anti-alias feather of the border and the pane edge, in device pixels, so it does not grow with display scaling. Lower is crisper."
        },
        {
            "id": "cycleSpeed",
            "name": "Cycle speed",
            "type": "float",
            "default": 0.1,
            "min": 0.0,
            "max": 1.0,
            "description": "How many full colour rotations play per second, where 0 freezes the rainbow"
        },
        {
            "id": "hueTurns",
            "name": "Rainbow count",
            "type": "float",
            "default": 1.0,
            "min": 0.5,
            "max": 4.0,
            "description": "How many full rainbows wrap around the frame at once. A value that is not a whole number leaves a hue seam at the middle of the left edge, widest at 0.5"
        },
        {
            "id": "saturation",
            "name": "Saturation",
            "type": "float",
            "default": 0.85,
            "min": 0.2,
            "max": 1.0,
            "description": "Colour intensity of the ring"
        },
        {
            "id": "brightness",
            "name": "Brightness",
            "type": "float",
            "default": 1.0,
            "min": 0.3,
            "max": 1.0,
            "description": "Peak brightness of the ring"
        }
    ]
}
