{
    "id": "border-pulse",
    "name": "Pulse Border",
    "description": "Rounded corners and a window border that breathes between two colours on a smooth cycle, with an optional brightness dip at the low end. The pulse dims when the surface loses focus.",
    "author": "PlasmaZones",
    "version": "1.1",
    "category": "Borders",
    "providesBorder": true,
    "animated": true,
    "fragmentShader": "effect.frag",
    "parameters": [
        {
            "id": "borderWidth",
            "name": "Border width",
            "type": "int",
            "default": 2,
            "min": 0,
            "max": 20,
            "description": "Thickness of the pulsing border (px). At 0 the pack draws nothing at all and the window keeps its own corners, so use a backdrop pack if you want rounding without a band"
        },
        {
            "id": "cornerRadius",
            "name": "Corner radius",
            "type": "int",
            "default": 8,
            "min": 0,
            "max": 64,
            "description": "Roundness of the corners (px, 0 for square)"
        },
        {
            "id": "roundBottomCorners",
            "name": "Round bottom corners",
            "type": "bool",
            "default": true,
            "description": "Round the bottom corners as well as the top. Turn off to round only the top two, for a pane that sits against a panel or the screen edge. Every pack in the chain that offers this setting follows one answer, so their bottom corners are all rounded or all square. Set it on any pack and the whole chain follows. Where two packs have it set differently, the one earliest in the chain wins."
        },
        {
            "id": "edgeSoftness",
            "name": "Edge softness",
            "type": "float",
            "default": 0.7,
            "min": 0.1,
            "max": 2.0,
            "description": "Anti-alias feather of the border and the pane edge, in device pixels, so it does not grow with display scaling. Lower is crisper."
        },
        {
            "id": "pulseSpeed",
            "name": "Pulse speed",
            "type": "float",
            "default": 0.4,
            "min": 0.05,
            "max": 3.0,
            "description": "How many pulse cycles play per second"
        },
        {
            "id": "pulseDepth",
            "name": "Dip depth",
            "type": "float",
            "default": 0.25,
            "min": 0.0,
            "max": 1.0,
            "description": "How far the border fades at the low end of the pulse, where 0 keeps it solid"
        },
        {
            "id": "colorA",
            "name": "First colour",
            "type": "color",
            "default": "#ff3daee9",
            "description": "Colour at the top of the pulse"
        },
        {
            "id": "colorB",
            "name": "Second colour",
            "type": "color",
            "default": "#ff9b59b6",
            "description": "Colour at the bottom of the pulse"
        }
    ]
}
