{
    "id": "rain-glass",
    "name": "Rain on Glass",
    "description": "The scene behind the window fogged by a blur, with rain droplets running down the pane. Each droplet refracts the scene and leaves a trail of beads that fade as it falls. Droplet size, Rain amount, Fall speed and Refraction set how big the drops are, how many fall, how fast they run and how hard each one bends the scene behind it. It shows through wherever the window itself is translucent, and the Content opacity parameter sets how much of the window content stays visible over the rain.",
    "author": "PlasmaZones",
    "version": "1.3",
    "category": "Blur",
    "animated": true,
    "fragmentShader": "effect.frag",
    "needsBackdrop": true,
    "multipass": true,
    "bufferShaders": [
        "builtin:kawase-down-0",
        "builtin:kawase-down-1",
        "builtin:kawase-down-2",
        "builtin:kawase-down-3",
        "builtin:kawase-up-0",
        "builtin:kawase-up-1",
        "builtin:kawase-up-2"
    ],
    "bufferScales": [
        0.25,
        0.125,
        0.0625,
        0.03125,
        0.0625,
        0.125,
        0.25
    ],
    "halfFloatBuffers": false,
    "parameters": [
        {
            "id": "blurRadius",
            "name": "Fog radius",
            "type": "int",
            "default": 20,
            "min": 2,
            "max": 256,
            "description": "How strongly the scene fogs behind the glass (px). Past a display scale of 125% the top of the range stops adding blur, and the lowest setting is already a soft blur rather than none",
            "group": "Blur"
        },
        {
            "id": "cornerRadius",
            "name": "Corner radius",
            "type": "int",
            "default": 8,
            "min": 0,
            "max": 64,
            "description": "Corner rounding of the pane (px, 0 for square)",
            "group": "Shape"
        },
        {
            "id": "contentOpacity",
            "name": "Content opacity",
            "type": "float",
            "default": 0.7,
            "min": 0.0,
            "max": 1.0,
            "group": "Content",
            "description": "How visible the window content stays over the pane, where 1.0 is fully opaque and 0.0 shows only the rained-on glass"
        },
        {
            "id": "dropletScale",
            "name": "Droplet size",
            "type": "float",
            "default": 1.0,
            "min": 0.5,
            "max": 2.0,
            "description": "Overall size of the droplets. Larger values mean bigger drops",
            "group": "Rain"
        },
        {
            "id": "rainAmount",
            "name": "Rain amount",
            "type": "float",
            "default": 0.7,
            "min": 0.1,
            "max": 1.0,
            "description": "How much of the pane carries droplets",
            "group": "Rain"
        },
        {
            "id": "rainSpeed",
            "name": "Fall speed",
            "type": "float",
            "default": 0.25,
            "min": 0.05,
            "max": 1.0,
            "description": "How quickly the droplets run down the pane",
            "group": "Rain"
        },
        {
            "id": "refraction",
            "name": "Refraction",
            "type": "float",
            "default": 40.0,
            "min": 5.0,
            "max": 100.0,
            "description": "How strongly droplets bend the scene behind them. It scales the droplet's own geometric offset, so 40 is that offset unchanged and 80 is twice it",
            "group": "Refraction"
        },
        {
            "id": "roundBottomCorners",
            "name": "Round bottom corners",
            "type": "bool",
            "default": true,
            "description": "Round the bottom corners as well as the top. Turn off to round only the top two, for a pane that sits against a panel or the screen edge. Every pack in the chain that offers this setting follows one answer, so their bottom corners are all rounded or all square. Set it on any pack and the whole chain follows. Where two packs have it set differently, the one earliest in the chain wins.",
            "group": "Shape"
        },
        {
            "id": "edgeSoftness",
            "name": "Edge softness",
            "type": "float",
            "default": 1.0,
            "min": 0.1,
            "max": 3.0,
            "description": "Anti-alias feather of the pane edge, in device pixels, so it does not grow with display scaling. Lower is crisper.",
            "group": "Shape"
        },
        {
            "id": "brightness",
            "name": "Brightness",
            "type": "float",
            "default": 1.0,
            "min": 0.0,
            "max": 2.0,
            "description": "Gain on the blurred scene. 1.0 leaves it as captured",
            "group": "Colour"
        },
        {
            "id": "contrast",
            "name": "Contrast",
            "type": "float",
            "default": 1.0,
            "min": 0.0,
            "max": 2.0,
            "description": "Contrast of the blurred scene around mid grey. 1.0 leaves it as captured",
            "group": "Colour"
        },
        {
            "id": "saturation",
            "name": "Saturation",
            "type": "float",
            "default": 1.0,
            "min": 0.0,
            "max": 2.0,
            "description": "Colour saturation of the blurred scene. 0 is greyscale and 1.0 leaves it as captured",
            "group": "Colour"
        },
        {
            "id": "noiseStrength",
            "name": "Noise",
            "type": "float",
            "default": 0.0,
            "min": 0.0,
            "max": 0.2,
            "description": "Fine grain over the blur that hides banding in smooth gradients",
            "group": "Colour"
        },
        {
            "id": "vibrancy",
            "name": "Vibrancy",
            "type": "float",
            "default": 0.0,
            "min": 0.0,
            "max": 1.0,
            "description": "Boosts saturation where a colour is already saturated and bright, so muted scenes stay muted. 0 turns it off, and Vibrancy darkness widens it to darker colours",
            "group": "Colour"
        },
        {
            "id": "vibrancyDarkness",
            "name": "Vibrancy darkness",
            "type": "float",
            "default": 0.0,
            "min": 0.0,
            "max": 1.0,
            "description": "How far the vibrancy boost reaches into darker colours. Does nothing while Vibrancy is 0, which is where it starts",
            "group": "Colour"
        },
        {
            "id": "edgeMirror",
            "name": "Mirror at the edge",
            "type": "bool",
            "default": false,
            "description": "Where the bend reaches past the pane's edge, fold the backdrop back inside. Left off, the bend keeps reading the captured scene beside the pane, which can make the edges look see-through",
            "group": "Refraction"
        }
    ]
}
