{
    "id": "glow",
    "name": "Glow",
    "description": "A soft coloured halo that hugs the surface's edge, brightest against the window and fading out over the glow size. It follows the frame's corners, rounded or squared, and draws only where the surface is not fully opaque, so a window with a see-through body picks up a little of it near the edge. It dims when the surface loses focus.",
    "author": "PlasmaZones",
    "version": "1.3",
    "category": "Ambience",
    "fragmentShader": "effect.frag",
    "interiorOpaque": true,
    "paddingParam": "glowSize",
    "parameters": [
        {
            "id": "glowStrength",
            "name": "Glow strength",
            "type": "float",
            "default": 0.7,
            "min": 0.0,
            "max": 2.0,
            "description": "Intensity of the halo at the window edge"
        },
        {
            "id": "glowSize",
            "name": "Glow size",
            "type": "int",
            "default": 24,
            "min": 4,
            "max": 64,
            "description": "How far the halo reaches from the edge (px)"
        },
        {
            "id": "cornerRadius",
            "name": "Corner radius",
            "type": "int",
            "default": 8,
            "min": 0,
            "max": 64,
            "description": "Corner rounding the halo follows (px). The halo traces this radius on the window frame. A Border pack earlier in the chain paints its band from its own corner radius out to that radius plus its border width, so match this to the sum for the two to meet, as far as the 64 px this control stops at. At a border radius of 0 the band stays square and nothing sits further out. On an OSD or a popup the host sets this and the border radius to the card's own radius, so the halo's falloff reaches about 0.4 of the border width further out at the corners than along the edges. At the default border width that is under a pixel on an unscaled display. At a thick border the corners carry a plainly fatter halo, and with a small glow size the halo stands off the corner instead. You cannot correct it here."
        },
        {
            "id": "roundBottomCorners",
            "name": "Round bottom corners",
            "type": "bool",
            "default": true,
            "description": "Round the bottom corners as well as the top. Turn off to round only the top two, for a pane that sits against a panel or the screen edge. Every pack in the chain that offers this setting follows one answer, so their bottom corners are all rounded or all square. Set it on any pack and the whole chain follows. Where two packs have it set differently, the one earliest in the chain wins."
        },
        {
            "id": "glowColor",
            "name": "Glow tint",
            "type": "color",
            "default": "#ff3daee9",
            "description": "Colour of the halo"
        },
        {
            "id": "useThemeTint",
            "name": "Tint with theme background",
            "type": "bool",
            "default": false,
            "description": "Tint the halo with the system background colour (keeping its alpha) so it tracks the theme instead of a fixed colour"
        }
    ]
}
