{
    "id": "mosaic",
    "name": "Mosaic",
    "description": "The scene behind the window pixelated into coarse cells instead of blurred, the privacy-glass look. Nothing behind the window is readable but its colours still show through. It shows through wherever the window itself is translucent, and the Content opacity parameter sets how much of the window content stays visible over the mosaic.",
    "author": "PlasmaZones",
    "version": "1.3",
    "category": "Blur",
    "fragmentShader": "effect.frag",
    "needsBackdrop": true,
    "parameters": [
        {
            "id": "cellSize",
            "name": "Cell size",
            "type": "int",
            "default": 14,
            "min": 4,
            "max": 48,
            "description": "Size of the mosaic cells (px), larger cells hide more",
            "group": "Mosaic"
        },
        {
            "id": "cornerRadius",
            "name": "Corner radius",
            "type": "int",
            "default": 8,
            "min": 0,
            "max": 64,
            "description": "Corner rounding of the pane (px, match the Border pack)",
            "group": "Shape"
        },
        {
            "id": "contentOpacity",
            "name": "Content opacity",
            "type": "float",
            "default": 0.7,
            "min": 0.0,
            "max": 1.0,
            "group": "Content",
            "description": "How visible the window content stays over the pane, where 1.0 is fully opaque and 0.0 shows only the mosaic"
        },
        {
            "id": "tintStrength",
            "name": "Tint strength",
            "type": "float",
            "default": 0.12,
            "min": 0.0,
            "max": 1.0,
            "description": "How strongly the tint colour washes over the cells",
            "group": "Tint"
        },
        {
            "id": "tintColor",
            "name": "Tint colour",
            "type": "color",
            "default": "#ff1d1d2e",
            "description": "Colour washed over the mosaic",
            "group": "Tint"
        },
        {
            "id": "roundBottomCorners",
            "name": "Round bottom corners",
            "type": "bool",
            "default": true,
            "description": "Round the bottom corners as well as the top. Turn off for a pane that only rounds under a title bar",
            "group": "Shape"
        },
        {
            "id": "edgeSoftness",
            "name": "Edge softness",
            "type": "float",
            "default": 1.0,
            "min": 0.1,
            "max": 3.0,
            "description": "Anti-alias feather of the pane edge (px). Lower is crisper",
            "group": "Shape"
        }
    ]
}
