{
    "id": "border-audio",
    "name": "Audio Border",
    "description": "A rounded border that pulses with the music. The bass energy pushes the border toward a pulse colour and brightens it on each beat. It reacts on window borders, OSDs and popups whenever the audio visualizer is turned on, and stays a plain static frame when it is off.",
    "author": "PlasmaZones",
    "version": "1.1",
    "category": "Borders",
    "providesBorder": true,
    "animated": true,
    "audio": true,
    "fragmentShader": "effect.frag",
    "parameters": [
        {
            "id": "borderWidth",
            "name": "Border width",
            "type": "int",
            "default": 3,
            "min": 0,
            "max": 20,
            "description": "Thickness of the coloured border (px). At 0 the pack draws nothing at all and the window keeps its own corners, so use a backdrop pack if you want rounding without a band"
        },
        {
            "id": "cornerRadius",
            "name": "Corner radius",
            "type": "int",
            "default": 8,
            "min": 0,
            "max": 64,
            "description": "Roundness of the corners (px, 0 for square)"
        },
        {
            "id": "roundBottomCorners",
            "name": "Round bottom corners",
            "type": "bool",
            "default": true,
            "description": "Round the bottom corners as well as the top. Turn off to round only the top two, for a pane that sits against a panel or the screen edge. Every pack in the chain that offers this setting follows one answer, so their bottom corners are all rounded or all square. Set it on any pack and the whole chain follows. Where two packs have it set differently, the one earliest in the chain wins."
        },
        {
            "id": "edgeSoftness",
            "name": "Edge softness",
            "type": "float",
            "default": 0.7,
            "min": 0.1,
            "max": 2.0,
            "description": "Anti-alias feather of the border and the pane edge, in device pixels, so it does not grow with display scaling. Lower is crisper."
        },
        {
            "id": "reactivity",
            "name": "Audio reactivity",
            "type": "float",
            "default": 1.5,
            "min": 0.0,
            "max": 4.0,
            "description": "How strongly the border reacts to the bass"
        },
        {
            "id": "activeColor",
            "name": "Active colour",
            "type": "color",
            "default": "#ff3daee9",
            "description": "Border colour when the window is focused"
        },
        {
            "id": "inactiveColor",
            "name": "Inactive colour",
            "type": "color",
            "default": "#ff5c6370",
            "description": "Border colour when the window is unfocused"
        },
        {
            "id": "pulseColor",
            "name": "Pulse colour",
            "type": "color",
            "default": "#fff67400",
            "description": "Colour the border pulses toward on a beat"
        }
    ]
}
