{
    "id": "border",
    "name": "Border",
    "description": "Rounded corners and a window border. Clips the surface to a rounded rectangle and lays a configurable border band over the desktop, so a translucent border blends with what is behind the surface rather than its own content.",
    "author": "PlasmaZones",
    "version": "1.2",
    "category": "Borders",
    "providesBorder": true,
    "fragmentShader": "effect.frag",
    "parameters": [
        {
            "id": "borderWidth",
            "name": "Border width",
            "type": "int",
            "default": 2,
            "min": 0,
            "max": 20,
            "description": "Thickness of the coloured border (px). At 0 the pack draws nothing at all and the window keeps its own corners, so use a backdrop pack if you want rounding without a band."
        },
        {
            "id": "cornerRadius",
            "name": "Corner radius",
            "type": "int",
            "default": 8,
            "min": 0,
            "max": 64,
            "description": "Roundness of the corners (px, 0 for square)"
        },
        {
            "id": "roundBottomCorners",
            "name": "Round bottom corners",
            "type": "bool",
            "default": true,
            "description": "Round the bottom corners as well as the top. Turn off to round only the top two, for a pane that sits against a panel or the screen edge. Every pack in the chain that offers this setting follows one answer, so their bottom corners are all rounded or all square. Set it on any pack and the whole chain follows. Where two packs have it set differently, the one earliest in the chain wins."
        },
        {
            "id": "edgeSoftness",
            "name": "Edge softness",
            "type": "float",
            "default": 0.7,
            "min": 0.1,
            "max": 2.0,
            "description": "Anti-alias feather of the border and the pane edge, in device pixels, so it does not grow with display scaling. Lower is crisper."
        },
        {
            "id": "useSystemAccent",
            "name": "Use system accent colour",
            "type": "bool",
            "default": true,
            "description": "Derive the border colours from the system colour scheme"
        },
        {
            "id": "useThemeNeutral",
            "name": "Use neutral theme colour",
            "type": "bool",
            "default": false,
            "description": "Derive a neutral frame-contrast border colour from the theme instead of the accent. Wins over the accent option when both are on."
        },
        {
            "id": "frameContrast",
            "name": "Frame contrast",
            "type": "float",
            "default": 0.2,
            "min": 0.0,
            "max": 1.0,
            "description": "How far the neutral border colour sits between the theme background (0) and foreground (1). Only applies when Use neutral theme colour is on."
        },
        {
            "id": "activeColor",
            "name": "Active colour",
            "type": "color",
            "default": "#ff3daee9",
            "description": "Border colour when the window is focused"
        },
        {
            "id": "inactiveColor",
            "name": "Inactive colour",
            "type": "color",
            "default": "#ff5c6370",
            "description": "Border colour when the window is unfocused"
        }
    ]
}
