{
    "id": "rippled-glass",
    "name": "Rippled Glass",
    "description": "A pane of rippled glass over the scene behind the window. The blurred backdrop warps across the whole pane under a drifting watery distortion, with slight colour fringing and soft highlights along the ripples. It shows through wherever the window itself is translucent, and the Content opacity parameter sets how much of the window content stays visible over the ripples.",
    "author": "PlasmaZones",
    "version": "1.3",
    "category": "Blur",
    "fragmentShader": "effect.frag",
    "needsBackdrop": true,
    "animated": true,
    "multipass": true,
    "bufferShaders": [
        "builtin:kawase-down-0",
        "builtin:kawase-down-1",
        "builtin:kawase-down-2",
        "builtin:kawase-down-3",
        "builtin:kawase-up-0",
        "builtin:kawase-up-1",
        "builtin:kawase-up-2"
    ],
    "bufferScales": [
        0.25,
        0.125,
        0.0625,
        0.03125,
        0.0625,
        0.125,
        0.25
    ],
    "parameters": [
        {
            "id": "blurRadius",
            "name": "Blur radius",
            "type": "int",
            "default": 16,
            "min": 2,
            "max": 256,
            "description": "How strongly the scene behind the glass is blurred (px)",
            "group": "Blur"
        },
        {
            "id": "cornerRadius",
            "name": "Corner radius",
            "type": "int",
            "default": 8,
            "min": 0,
            "max": 64,
            "description": "Corner rounding of the glass pane (px, match the Border pack)",
            "group": "Shape"
        },
        {
            "id": "contentOpacity",
            "name": "Content opacity",
            "type": "float",
            "default": 0.7,
            "min": 0.0,
            "max": 1.0,
            "group": "Content",
            "description": "How visible the window content stays over the pane, where 1.0 is fully opaque and 0.0 shows only the rippled backdrop"
        },
        {
            "id": "refractionStrength",
            "name": "Ripple strength",
            "type": "float",
            "default": 10.0,
            "min": 0.0,
            "max": 40.0,
            "description": "How far the ripples bend the backdrop (px)",
            "group": "Refraction"
        },
        {
            "id": "rippleSize",
            "name": "Ripple size",
            "type": "float",
            "default": 48.0,
            "min": 12.0,
            "max": 160.0,
            "description": "Size of the individual ripples (px)",
            "group": "Refraction"
        },
        {
            "id": "rippleSpeed",
            "name": "Ripple drift",
            "type": "float",
            "default": 0.2,
            "min": 0.0,
            "max": 2.0,
            "description": "How quickly the ripples drift, where 0 freezes them",
            "group": "Refraction"
        },
        {
            "id": "fringing",
            "name": "Colour fringing",
            "type": "float",
            "default": 0.25,
            "min": 0.0,
            "max": 1.0,
            "description": "Chromatic split between the red and blue refraction",
            "group": "Refraction"
        },
        {
            "id": "highlightStrength",
            "name": "Ripple highlights",
            "type": "float",
            "default": 0.25,
            "min": 0.0,
            "max": 1.0,
            "description": "Strength of the light caught along the ripple crests",
            "group": "Lighting"
        },
        {
            "id": "tintStrength",
            "name": "Tint strength",
            "type": "float",
            "default": 0.1,
            "min": 0.0,
            "max": 1.0,
            "description": "How much of the tint colour is mixed over the glass",
            "group": "Tint"
        },
        {
            "id": "tintColor",
            "name": "Tint colour",
            "type": "color",
            "default": "#ffffffff",
            "description": "Colour mixed over the glass",
            "group": "Tint"
        },
        {
            "id": "roundBottomCorners",
            "name": "Round bottom corners",
            "type": "bool",
            "default": true,
            "description": "Round the bottom corners as well as the top. Turn off to round only the top two",
            "group": "Shape"
        },
        {
            "id": "edgeSoftness",
            "name": "Edge softness",
            "type": "float",
            "default": 1.0,
            "min": 0.1,
            "max": 3.0,
            "description": "Anti-alias feather of the pane edge, in device pixels, so it does not grow with display scaling. Lower is crisper",
            "group": "Shape"
        },
        {
            "id": "brightness",
            "name": "Brightness",
            "type": "float",
            "default": 1.0,
            "min": 0.0,
            "max": 2.0,
            "description": "Gain on the finished pane, the refracted scene with the ripple glint already on it. 1.0 leaves it unchanged",
            "group": "Colour"
        },
        {
            "id": "contrast",
            "name": "Contrast",
            "type": "float",
            "default": 1.0,
            "min": 0.0,
            "max": 2.0,
            "description": "Contrast of the finished pane around mid grey, ripple glint included. 1.0 leaves it unchanged",
            "group": "Colour"
        },
        {
            "id": "saturation",
            "name": "Saturation",
            "type": "float",
            "default": 1.0,
            "min": 0.0,
            "max": 2.0,
            "description": "Colour saturation of the finished pane, ripple glint included. 0 is greyscale and 1.0 leaves it unchanged",
            "group": "Colour"
        },
        {
            "id": "noiseStrength",
            "name": "Noise",
            "type": "float",
            "default": 0.0,
            "min": 0.0,
            "max": 0.2,
            "description": "Fine grain over the blur that hides banding in smooth gradients",
            "group": "Colour"
        },
        {
            "id": "vibrancy",
            "name": "Vibrancy",
            "type": "float",
            "default": 0.0,
            "min": 0.0,
            "max": 1.0,
            "description": "Boosts saturation where a colour is already saturated and bright, so muted scenes stay muted. 0 turns it off, and Vibrancy darkness widens it to darker colours",
            "group": "Colour"
        },
        {
            "id": "vibrancyDarkness",
            "name": "Vibrancy darkness",
            "type": "float",
            "default": 0.0,
            "min": 0.0,
            "max": 1.0,
            "description": "How far the vibrancy boost reaches into darker colours. Does nothing while Vibrancy is 0, which is where it starts",
            "group": "Colour"
        },
        {
            "id": "edgeMirror",
            "name": "Mirror at the edge",
            "type": "bool",
            "default": false,
            "description": "Where the bend reaches past the pane's edge, fold the backdrop back inside. Left off, the bend keeps reading the captured scene beside the pane, which can make the edges look see-through",
            "group": "Refraction"
        }
    ]
}
